<?xml version="1.0" encoding="UTF-8"?><Configuration xmlns:xsi="http://www.w3.org/2001/XMLSchema-instance" xsi:noNamespaceSchemaLocation="schema/update.xsd">    <SurvivorHelperConfig module-name="SurvivorHelper" parser-class="com.sun.mdm.index.configurator.impl.SurvivorHelperConfig">        <helper-class>com.sun.mdm.index.survivor.impl.DefaultSurvivorHelper</helper-class>        <default-survivor-strategy>            <strategy-class>com.sun.mdm.index.survivor.impl.WeightedSurvivorStrategy</strategy-class>            <parameters>                <parameter>                    <parameter-name>ConfigurationModuleName</parameter-name>                    <parameter-type>java.lang.String</parameter-type>                    <parameter-value>WeightedSurvivorCalculator</parameter-value>                </parameter>            </parameters>        </default-survivor-strategy>        <candidate-definitions>            <candidate-field name="USACitizen.FirstName"/>            <candidate-field name="USACitizen.FirstName_Std"/>            <candidate-field name="USACitizen.FirstName_Phon"/>            <candidate-field name="USACitizen.MiddleName"/>            <candidate-field name="USACitizen.LastName"/>            <candidate-field name="USACitizen.LastName_Std"/>            <candidate-field name="USACitizen.LastName_Phon"/>            <candidate-field name="USACitizen.Suffix"/>            <candidate-field name="USACitizen.Title"/>            <candidate-field name="USACitizen.SSN"/>            <candidate-field name="USACitizen.DOB"/>            <candidate-field name="USACitizen.Gender"/>            <candidate-field name="USACitizen.MStatus"/>            <candidate-field name="USACitizen.Race"/>            <candidate-field name="USACitizen.PobCity"/>            <candidate-field name="USACitizen.PobStateCode"/>            <candidate-field name="USACitizen.PobCountry"/>            <candidate-field name="USACitizen.DOD"/>            <candidate-field name="USACitizen.Height"/>            <candidate-field name="USACitizen.HairColor"/>            <candidate-field name="USACitizen.EyeColor"/>            <candidate-field name="USACitizen.Occupation"/>            <candidate-field name="USACitizen.Employer"/>            <candidate-field name="USACitizen.Email"/>            <candidate-field name="USACitizen.HasBirthCertificate"/>            <candidate-field name="USACitizen.Alias[*].*"/>            <candidate-field name="USACitizen.Address[*].*"/>            <candidate-field name="USACitizen.Phone[*].*"/>            <candidate-field name="USACitizen.Passport[*].*"/>            <candidate-field name="USACitizen.Id[*].*"/>            <candidate-field name="USACitizen.Family[*].*"/>            <candidate-field name="USACitizen.Contact[*].*"/>        </candidate-definitions>    </SurvivorHelperConfig>    <WeightedCalculator module-name="WeightedSurvivorCalculator" parser-class="com.sun.mdm.index.configurator.impl.WeightedCalculatorConfig">        <default-parameters>            <parameter>                <quality>SourceSystem</quality>                <preference>SUN</preference>                <utility>100.0</utility>            </parameter>            <parameter>                <quality>SourceSystem</quality>                <preference>MYSQL</preference>                <utility>100.0</utility>            </parameter>            <parameter>                <quality>MostRecentModified</quality>                <utility>75.0</utility>            </parameter>        </default-parameters>    </WeightedCalculator>    <UpdateManagerConfig module-name="UpdateManager" parser-class="com.sun.mdm.index.configurator.impl.UpdateManagerConfig">        <EnterpriseMergePolicy></EnterpriseMergePolicy>        <EnterpriseUnmergePolicy></EnterpriseUnmergePolicy>        <EnterpriseUpdatePolicy></EnterpriseUpdatePolicy>        <EnterpriseCreatePolicy></EnterpriseCreatePolicy>        <SystemMergePolicy></SystemMergePolicy>        <SystemUnmergePolicy></SystemUnmergePolicy>        <UndoAssumeMatchPolicy></UndoAssumeMatchPolicy>        <SkipUpdateIfNoChange>true</SkipUpdateIfNoChange>    </UpdateManagerConfig></Configuration>